{
  "id": "AL-1",
  "title": "An employee can approve their own leave request (and a colleague's)",
  "sev": "high",
  "area": "approvals",
  "summary": "The approve endpoint does not check who is calling. Any logged-in employee can approve their own request, or a colleague's, through the API. The page hides the Approve button, but the server accepts the call, so managers lose control over who is off.",
  "steps": [
    "Log in as Ben (employee).",
    "Request one day of leave, for example Monday 4 February 2030. It appears as pending.",
    "Send POST /api/requests/<id>/approve as Ben (from the browser console, or any HTTP client with his session).",
    "Reload My leave: the request is approved and the balance went down by one day."
  ],
  "expected": {
    "text": "Only a manager can approve, and nobody can decide their own request. Anyone else gets HTTP 403 and the request stays pending.",
    "requirement": "R4",
    "link": "apps/local/acme-leave/docs/prd.md#us-3-decide"
  },
  "actual": "HTTP 200. The request is stored as approved with decided_by = Ben's own user id.",
  "where": {
    "file": "src/leave.mjs",
    "function": "approveRequest"
  },
  "how": {
    "response": "POST /api/requests/1/approve as ben@acme.example → 200 {\"status\":\"approved\",\"decided_by\":2}",
    "state": "SELECT status, decided_by FROM requests WHERE id = 1 → approved, 2 (Ben). Read-only query on the local database.",
    "byDesignCheck": "PRD R4 is explicit. Confirmed with the app owner (Dana, fictional) on 2026-10-25: not by design."
  },
  "related": [],
  "state": "open",
  "hint": "In approveRequest, do what rejectRequest already does: refuse with 403 unless user.role is 'manager', and refuse with 403 when req.user_id === user.id. Check both before the UPDATE.",
  "prd": "US-3 Decide",
  "spec": "qa/acme-leave/specs/regression/approvals.spec.mjs",
  "video": "qa/acme-leave/videos/AL-1-employee-approves-own-request.webm",
  "environment": "local, commit e0eab5e4",
  "foundAt": "2026-10-25",
  "run": "20261025-0006-nightly"
}
